{
  "$schema": "https://json-schema.org/draft/2020-12/schema",
  "type": "object",
  "properties": {
    "title": { "type": "string", "description": "Display name for the template" },
    "description": { "type": "string", "description": "What this template is for" },
    "tags": { "type": "array", "items": { "type": "string" }, "description": "Searchable tags" },
    "author": { "type": "string" },
    "version": { "type": "string", "description": "Semver version" },
    "exportPresets": {
      "type": "array",
      "items": { "type": "object", "properties": { "name": { "type": "string" }, "format": { "type": "string" } } },
      "description": "Mill export presets — defines how this template can be exported (consumed by mill)"
    },
    "seedPacks": {
      "type": "array",
      "items": { "type": "string" },
      "description": "Silo knowledge packs to pre-load when instantiating this template (consumed by silo)"
    },
    "scaffoldConfig": {
      "type": "object",
      "description": "Orchard scaffold configuration — how to bootstrap a new sprint from this template (consumed by orchard)"
    }
  }
}
